{
  "schema_version": 1,
  "scope": "V2-DATA-MIGRATION-CONTRACTS-001",
  "environment": "contract_fixture",
  "physical_eol_deletion_started": false,
  "production_mutation": false,
  "rows": [
    {
      "inventory_id": "DEP-CON-0001",
      "repository": "autostream-contracts",
      "model_or_contract": "Drive destination base_path retention",
      "strategy": "retain data / remove runtime reference",
      "migration_task": "V2-DATA-MIGRATION-CONTRACTS-001",
      "deletion_task": "V2-COMPAT-EOL-CONTRACTS-001",
      "expected_non_empty": true,
      "replacement": { "status": "PASS", "authority": "folder_id is the archive root and remains an opaque secret reference" },
      "backup": { "status": "PASS", "artifact_id": "fixture-drive-destination-before", "record_count": 1, "checksum_sha256": "1111111111111111111111111111111111111111111111111111111111111111" },
      "restore": { "status": "PASS", "artifact_id": "fixture-drive-destination-restored", "record_count": 1, "checksum_sha256": "1111111111111111111111111111111111111111111111111111111111111111" },
      "pre_counts": { "source_count": 1, "represented_count": 1 },
      "post_counts": { "source_count": 1, "represented_count": 1 },
      "orphan_count": 0,
      "idempotence": "PASS",
      "rollback": "PASS"
    },
    {
      "inventory_id": "DEP-CON-0003",
      "repository": "autostream-contracts",
      "model_or_contract": "Retained archive records receive explicit run identity",
      "strategy": "archive read-only",
      "migration_task": "V2-DATA-MIGRATION-CONTRACTS-001",
      "deletion_task": "V2-COMPAT-EOL-CONTRACTS-001",
      "expected_non_empty": true,
      "replacement": { "status": "PASS", "authority": "archive_run_id plus started_at is the v2 run identity" },
      "backup": { "status": "PASS", "artifact_id": "fixture-archive-run-before", "record_count": 2, "checksum_sha256": "2222222222222222222222222222222222222222222222222222222222222222" },
      "restore": { "status": "PASS", "artifact_id": "fixture-archive-run-restored", "record_count": 2, "checksum_sha256": "2222222222222222222222222222222222222222222222222222222222222222" },
      "pre_counts": { "source_count": 2, "represented_count": 2 },
      "post_counts": { "source_count": 2, "represented_count": 2 },
      "orphan_count": 0,
      "idempotence": "PASS",
      "rollback": "PASS"
    },
    {
      "inventory_id": "DEP-CON-0005",
      "repository": "autostream-contracts",
      "model_or_contract": "Encrypted stream-key records remain while raw request references retire",
      "strategy": "retain data / remove runtime reference",
      "migration_task": "V2-DATA-MIGRATION-CONTRACTS-001",
      "deletion_task": "V2-COMPAT-EOL-CONTRACTS-001",
      "expected_non_empty": true,
      "replacement": { "status": "PASS", "authority": "stream_key_secret_name is the non-secret runtime reference" },
      "backup": { "status": "PASS", "artifact_id": "fixture-stream-key-reference-before", "record_count": 1, "checksum_sha256": "3333333333333333333333333333333333333333333333333333333333333333" },
      "restore": { "status": "PASS", "artifact_id": "fixture-stream-key-reference-restored", "record_count": 1, "checksum_sha256": "3333333333333333333333333333333333333333333333333333333333333333" },
      "pre_counts": { "source_count": 1, "represented_count": 1 },
      "post_counts": { "source_count": 1, "represented_count": 1 },
      "orphan_count": 0,
      "idempotence": "PASS",
      "rollback": "PASS"
    },
    {
      "inventory_id": "DEP-CON-0010",
      "repository": "autostream-contracts",
      "model_or_contract": "Legacy channel SMTP settings transform to Control Panel global authority",
      "strategy": "transform",
      "migration_task": "V2-DATA-MIGRATION-CONTRACTS-001",
      "deletion_task": "V2-COMPAT-EOL-CONTRACTS-001",
      "expected_non_empty": true,
      "replacement": { "status": "PASS", "authority": "control_panel/global_smtp is the non-secret configuration reference" },
      "backup": { "status": "PASS", "artifact_id": "fixture-notification-channel-before", "record_count": 1, "checksum_sha256": "4444444444444444444444444444444444444444444444444444444444444444" },
      "restore": { "status": "PASS", "artifact_id": "fixture-notification-channel-restored", "record_count": 1, "checksum_sha256": "4444444444444444444444444444444444444444444444444444444444444444" },
      "pre_counts": { "source_count": 1, "represented_count": 1 },
      "post_counts": { "source_count": 1, "represented_count": 1 },
      "orphan_count": 0,
      "idempotence": "PASS",
      "rollback": "PASS"
    },
    {
      "inventory_id": "DEP-CON-0012",
      "repository": "autostream-contracts",
      "model_or_contract": "Linked OAuth accounts and encrypted grants remain after manual-write retirement",
      "strategy": "retain data / remove runtime reference",
      "migration_task": "V2-DATA-MIGRATION-CONTRACTS-001",
      "deletion_task": "V2-COMPAT-EOL-CONTRACTS-001",
      "expected_non_empty": true,
      "replacement": { "status": "PASS", "authority": "provider authorization and relink flow owns account subject and grant rotation" },
      "backup": { "status": "PASS", "artifact_id": "fixture-oauth-account-before", "record_count": 1, "checksum_sha256": "5555555555555555555555555555555555555555555555555555555555555555" },
      "restore": { "status": "PASS", "artifact_id": "fixture-oauth-account-restored", "record_count": 1, "checksum_sha256": "5555555555555555555555555555555555555555555555555555555555555555" },
      "pre_counts": { "source_count": 1, "represented_count": 1 },
      "post_counts": { "source_count": 1, "represented_count": 1 },
      "orphan_count": 0,
      "idempotence": "PASS",
      "rollback": "PASS"
    }
  ]
}
